[
  {
    "ID Ciclo de Lucro": 0,
    "Data Início": "2023-01-02 09:25:00",
    "Data Fim": "2023-01-02 09:48:00",
    "Duração do Ciclo": "23min",
    "Lucro Gerado no Ciclo": 89.0,
    "Média Lucros Até o Ciclo": 0.0,
    "Percentil 25 Lucros Até o Ciclo": 0.0
  },
  {
    "ID Ciclo de Lucro": 1,
    "Data Início": "2023-01-02 11:02:00",
    "Data Fim": "2023-01-02 11:05:00",
    "Duração do Ciclo": "3min",
    "Lucro Gerado no Ciclo": 69.0,
    "Média Lucros Até o Ciclo": 89.0,
    "Percentil 25 Lucros Até o Ciclo": 89.0
  },
  {
    "ID Ciclo de Lucro": 2,
    "Data Início": "2023-01-02 12:46:00",
    "Data Fim": "2023-01-02 12:48:00",
    "Duração do Ciclo": "2min",
    "Lucro Gerado no Ciclo": 11.0,
    "Média Lucros Até o Ciclo": 79.0,
    "Percentil 25 Lucros Até o Ciclo": 74.0
  },
  {
    "ID Ciclo de Lucro": 3,
    "Data Início": "2023-01-02 14:54:00",
    "Data Fim": "2023-01-02 15:15:00",
    "Duração do Ciclo": "21min",
    "Lucro Gerado no Ciclo": 95.0,
    "Média Lucros Até o Ciclo": 56.33,
    "Percentil 25 Lucros Até o Ciclo": 40.0
  },
  {
    "ID Ciclo de Lucro": 4,
    "Data Início": "2023-01-02 15:32:00",
    "Data Fim": "2023-01-02 15:51:00",
    "Duração do Ciclo": "19min",
    "Lucro Gerado no Ciclo": 50.0,
    "Média Lucros Até o Ciclo": 66.0,
    "Percentil 25 Lucros Até o Ciclo": 54.5
  },
  {
    "ID Ciclo de Lucro": 5,
    "Data Início": "2023-01-02 16:53:00",
    "Data Fim": "2023-01-03 09:29:00",
    "Duração do Ciclo": "16h 36min",
    "Lucro Gerado no Ciclo": 343.0,
    "Média Lucros Até o Ciclo": 62.8,
    "Percentil 25 Lucros Até o Ciclo": 50.0
  },
  {
    "ID Ciclo de Lucro": 6,
    "Data Início": "2023-01-03 11:05:00",
    "Data Fim": "2023-01-03 11:05:00",
    "Duração do Ciclo": "0min",
    "Lucro Gerado no Ciclo": 3.0,
    "Média Lucros Até o Ciclo": 109.5,
    "Percentil 25 Lucros Até o Ciclo": 54.75
  },
  {
    "ID Ciclo de Lucro": 7,
    "Data Início": "2023-01-03 11:55:00",
    "Data Fim": "2023-01-03 12:07:00",
    "Duração do Ciclo": "12min",
    "Lucro Gerado no Ciclo": 54.0,
    "Média Lucros Até o Ciclo": 94.29,
    "Percentil 25 Lucros Até o Ciclo": 30.5
  },
  {
    "ID Ciclo de Lucro": 8,
    "Data Início": "2023-01-03 12:24:00",
    "Data Fim": "2023-01-03 12:34:00",
    "Duração do Ciclo": "10min",
    "Lucro Gerado no Ciclo": 75.0,
    "Média Lucros Até o Ciclo": 89.25,
    "Percentil 25 Lucros Até o Ciclo": 40.25
  },
  {
    "ID Ciclo de Lucro": 9,
    "Data Início": "2023-01-03 16:49:00",
    "Data Fim": "2023-01-03 16:59:00",
    "Duração do Ciclo": "10min",
    "Lucro Gerado no Ciclo": 66.0,
    "Média Lucros Até o Ciclo": 87.67,
    "Percentil 25 Lucros Até o Ciclo": 50.0
  },
  {
    "ID Ciclo de Lucro": 10,
    "Data Início": "2023-01-04 10:08:00",
    "Data Fim": "2023-01-04 10:21:00",
    "Duração do Ciclo": "13min",
    "Lucro Gerado no Ciclo": 173.0,
    "Média Lucros Até o Ciclo": 85.5,
    "Percentil 25 Lucros Até o Ciclo": 51.0
  },
  {
    "ID Ciclo de Lucro": 11,
    "Data Início": "2023-01-04 10:51:00",
    "Data Fim": "2023-01-04 12:04:00",
    "Duração do Ciclo": "1h 13min",
    "Lucro Gerado no Ciclo": 1080.0,
    "Média Lucros Até o Ciclo": 93.45,
    "Percentil 25 Lucros Até o Ciclo": 52.0
  },
  {
    "ID Ciclo de Lucro": 12,
    "Data Início": "2023-01-05 12:31:00",
    "Data Fim": "2023-01-05 14:19:00",
    "Duração do Ciclo": "1h 48min",
    "Lucro Gerado no Ciclo": 809.0,
    "Média Lucros Até o Ciclo": 175.67,
    "Percentil 25 Lucros Até o Ciclo": 53.0
  },
  {
    "ID Ciclo de Lucro": 13,
    "Data Início": "2023-01-05 14:30:00",
    "Data Fim": "2023-01-05 14:46:00",
    "Duração do Ciclo": "16min",
    "Lucro Gerado no Ciclo": 60.0,
    "Média Lucros Até o Ciclo": 224.38,
    "Percentil 25 Lucros Até o Ciclo": 54.0
  },
  {
    "ID Ciclo de Lucro": 14,
    "Data Início": "2023-01-05 15:56:00",
    "Data Fim": "2023-01-05 16:16:00",
    "Duração do Ciclo": "20min",
    "Lucro Gerado no Ciclo": 126.0,
    "Média Lucros Até o Ciclo": 212.64,
    "Percentil 25 Lucros Até o Ciclo": 55.5
  },
  {
    "ID Ciclo de Lucro": 15,
    "Data Início": "2023-01-05 16:29:00",
    "Data Fim": "2023-01-05 17:30:00",
    "Duração do Ciclo": "1h 1min",
    "Lucro Gerado no Ciclo": 231.0,
    "Média Lucros Até o Ciclo": 206.87,
    "Percentil 25 Lucros Até o Ciclo": 57.0
  },
  {
    "ID Ciclo de Lucro": 16,
    "Data Início": "2023-01-06 09:01:00",
    "Data Fim": "2023-01-06 09:39:00",
    "Duração do Ciclo": "38min",
    "Lucro Gerado no Ciclo": 296.0,
    "Média Lucros Até o Ciclo": 208.38,
    "Percentil 25 Lucros Até o Ciclo": 58.5
  },
  {
    "ID Ciclo de Lucro": 17,
    "Data Início": "2023-01-06 09:53:00",
    "Data Fim": "2023-01-06 10:05:00",
    "Duração do Ciclo": "12min",
    "Lucro Gerado no Ciclo": 77.0,
    "Média Lucros Até o Ciclo": 213.53,
    "Percentil 25 Lucros Até o Ciclo": 60.0
  },
  {
    "ID Ciclo de Lucro": 18,
    "Data Início": "2023-01-06 10:32:00",
    "Data Fim": "2023-01-06 10:40:00",
    "Duração do Ciclo": "8min",
    "Lucro Gerado no Ciclo": 164.0,
    "Média Lucros Até o Ciclo": 205.94,
    "Percentil 25 Lucros Até o Ciclo": 61.5
  },
  {
    "ID Ciclo de Lucro": 19,
    "Data Início": "2023-01-09 11:28:00",
    "Data Fim": "2023-01-09 11:40:00",
    "Duração do Ciclo": "12min",
    "Lucro Gerado no Ciclo": 147.0,
    "Média Lucros Até o Ciclo": 203.74,
    "Percentil 25 Lucros Até o Ciclo": 63.0
  },
  {
    "ID Ciclo de Lucro": 20,
    "Data Início": "2023-01-10 10:56:00",
    "Data Fim": "2023-01-10 11:32:00",
    "Duração do Ciclo": "36min",
    "Lucro Gerado no Ciclo": 160.0,
    "Média Lucros Até o Ciclo": 200.9,
    "Percentil 25 Lucros Até o Ciclo": 64.5
  },
  {
    "ID Ciclo de Lucro": 21,
    "Data Início": "2023-01-10 13:40:00",
    "Data Fim": "2023-01-10 13:56:00",
    "Duração do Ciclo": "16min",
    "Lucro Gerado no Ciclo": 13.0,
    "Média Lucros Até o Ciclo": 198.95,
    "Percentil 25 Lucros Até o Ciclo": 66.0
  },
  {
    "ID Ciclo de Lucro": 22,
    "Data Início": "2023-01-10 14:00:00",
    "Data Fim": "2023-01-10 14:03:00",
    "Duração do Ciclo": "3min",
    "Lucro Gerado no Ciclo": 24.0,
    "Média Lucros Até o Ciclo": 190.5,
    "Percentil 25 Lucros Até o Ciclo": 61.5
  },
  {
    "ID Ciclo de Lucro": 23,
    "Data Início": "2023-01-10 14:07:00",
    "Data Fim": "2023-01-10 15:15:00",
    "Duração do Ciclo": "1h 8min",
    "Lucro Gerado no Ciclo": 371.0,
    "Média Lucros Até o Ciclo": 183.26,
    "Percentil 25 Lucros Até o Ciclo": 57.0
  },
  {
    "ID Ciclo de Lucro": 24,
    "Data Início": "2023-01-10 15:18:00",
    "Data Fim": "2023-01-11 09:44:00",
    "Duração do Ciclo": "18h 26min",
    "Lucro Gerado no Ciclo": 621.0,
    "Média Lucros Até o Ciclo": 191.08,
    "Percentil 25 Lucros Até o Ciclo": 58.5
  },
  {
    "ID Ciclo de Lucro": 25,
    "Data Início": "2023-01-12 10:00:00",
    "Data Fim": "2023-01-12 10:02:00",
    "Duração do Ciclo": "2min",
    "Lucro Gerado no Ciclo": 33.0,
    "Média Lucros Até o Ciclo": 208.28,
    "Percentil 25 Lucros Até o Ciclo": 60.0
  },
  {
    "ID Ciclo de Lucro": 26,
    "Data Início": "2023-01-12 10:15:00",
    "Data Fim": "2023-01-12 10:49:00",
    "Duração do Ciclo": "34min",
    "Lucro Gerado no Ciclo": 519.0,
    "Média Lucros Até o Ciclo": 201.54,
    "Percentil 25 Lucros Até o Ciclo": 55.5
  },
  {
    "ID Ciclo de Lucro": 27,
    "Data Início": "2023-01-16 10:45:00",
    "Data Fim": "2023-01-16 11:04:00",
    "Duração do Ciclo": "19min",
    "Lucro Gerado no Ciclo": 230.0,
    "Média Lucros Até o Ciclo": 213.3,
    "Percentil 25 Lucros Até o Ciclo": 57.0
  },
  {
    "ID Ciclo de Lucro": 28,
    "Data Início": "2023-01-16 13:12:00",
    "Data Fim": "2023-01-16 13:18:00",
    "Duração do Ciclo": "6min",
    "Lucro Gerado no Ciclo": 35.0,
    "Média Lucros Até o Ciclo": 213.89,
    "Percentil 25 Lucros Até o Ciclo": 58.5
  },
  {
    "ID Ciclo de Lucro": 29,
    "Data Início": "2023-01-16 14:00:00",
    "Data Fim": "2023-01-16 14:01:00",
    "Duração do Ciclo": "1min",
    "Lucro Gerado no Ciclo": 5.0,
    "Média Lucros Até o Ciclo": 207.72,
    "Percentil 25 Lucros Até o Ciclo": 54.0
  },
  {
    "ID Ciclo de Lucro": 30,
    "Data Início": "2023-01-17 09:13:00",
    "Data Fim": "2023-01-17 09:47:00",
    "Duração do Ciclo": "34min",
    "Lucro Gerado no Ciclo": 140.0,
    "Média Lucros Até o Ciclo": 200.97,
    "Percentil 25 Lucros Até o Ciclo": 51.0
  },
  {
    "ID Ciclo de Lucro": 31,
    "Data Início": "2023-01-17 12:24:00",
    "Data Fim": "2023-01-17 12:26:00",
    "Duração do Ciclo": "2min",
    "Lucro Gerado no Ciclo": 16.0,
    "Média Lucros Até o Ciclo": 199.0,
    "Percentil 25 Lucros Até o Ciclo": 52.0
  },
  {
    "ID Ciclo de Lucro": 32,
    "Data Início": "2023-01-17 12:38:00",
    "Data Fim": "2023-01-17 13:02:00",
    "Duração do Ciclo": "24min",
    "Lucro Gerado no Ciclo": 13.0,
    "Média Lucros Até o Ciclo": 193.28,
    "Percentil 25 Lucros Até o Ciclo": 46.25
  },
  {
    "ID Ciclo de Lucro": 33,
    "Data Início": "2023-01-17 14:46:00",
    "Data Fim": "2023-01-17 14:57:00",
    "Duração do Ciclo": "11min",
    "Lucro Gerado no Ciclo": 62.0,
    "Média Lucros Até o Ciclo": 187.82,
    "Percentil 25 Lucros Até o Ciclo": 35.0
  },
  {
    "ID Ciclo de Lucro": 34,
    "Data Início": "2023-01-17 15:11:00",
    "Data Fim": "2023-01-17 15:38:00",
    "Duração do Ciclo": "27min",
    "Lucro Gerado no Ciclo": 155.0,
    "Média Lucros Até o Ciclo": 184.12,
    "Percentil 25 Lucros Até o Ciclo": 38.75
  },
  {
    "ID Ciclo de Lucro": 35,
    "Data Início": "2023-01-17 15:55:00",
    "Data Fim": "2023-01-17 16:11:00",
    "Duração do Ciclo": "16min",
    "Lucro Gerado no Ciclo": 57.0,
    "Média Lucros Até o Ciclo": 183.29,
    "Percentil 25 Lucros Até o Ciclo": 42.5
  },
  {
    "ID Ciclo de Lucro": 36,
    "Data Início": "2023-01-17 17:30:00",
    "Data Fim": "2023-01-18 09:05:00",
    "Duração do Ciclo": "15h 35min",
    "Lucro Gerado no Ciclo": 42.0,
    "Média Lucros Até o Ciclo": 179.78,